{
  "$schema": "https://json-schema.org/draft/2020-12/schema",
  "$id": "https://vocello.app/schemas/model-catalog-v2.json",
  "title": "Vocello production model catalog with shared components",
  "type": "object",
  "additionalProperties": false,
  "required": [
    "schemaVersion",
    "catalogSchema",
    "activationState",
    "allowedArtifactHosts",
    "allowedRedirectHostSuffixes",
    "sourceDigests",
    "artifacts",
    "sharedComponents",
    "missingArtifactIdentities"
  ],
  "properties": {
    "schemaVersion": { "const": 2 },
    "catalogSchema": { "const": "config/model-catalog-schema-v2.json" },
    "activationState": { "enum": ["staged", "complete"] },
    "allowedArtifactHosts": {
      "type": "array",
      "minItems": 1,
      "uniqueItems": true,
      "items": { "type": "string", "minLength": 1 }
    },
    "allowedRedirectHostSuffixes": {
      "type": "array",
      "minItems": 1,
      "uniqueItems": true,
      "items": { "type": "string", "minLength": 1 }
    },
    "sourceDigests": {
      "type": "object",
      "additionalProperties": { "type": "string", "pattern": "^[0-9a-f]{64}$" }
    },
    "artifacts": {
      "type": "array",
      "minItems": 1,
      "items": { "$ref": "#/$defs/artifact" }
    },
    "sharedComponents": {
      "type": "array",
      "minItems": 1,
      "items": { "$ref": "#/$defs/sharedComponent" }
    },
    "missingArtifactIdentities": {
      "type": "array",
      "uniqueItems": true,
      "items": { "type": "string", "pattern": "^[a-z0-9_]+:[a-z0-9_]+$" }
    }
  },
  "$defs": {
    "artifact": {
      "type": "object",
      "additionalProperties": false,
      "required": [
        "modelID",
        "variantID",
        "platforms",
        "folder",
        "repo",
        "revision",
        "artifactVersion",
        "baseURL",
        "totalBytes",
        "files",
        "sharedComponentIDs"
      ],
      "properties": {
        "modelID": { "type": "string", "minLength": 1 },
        "variantID": { "type": "string", "minLength": 1 },
        "platforms": {
          "type": "array",
          "minItems": 1,
          "uniqueItems": true,
          "items": { "enum": ["iOS", "macOS"] }
        },
        "folder": { "type": "string", "minLength": 1 },
        "repo": { "type": "string", "pattern": "^[^/]+/[^/]+$" },
        "revision": { "type": "string", "pattern": "^[0-9a-f]{40}$" },
        "artifactVersion": { "type": "string", "minLength": 1 },
        "baseURL": { "type": "string", "pattern": "^https://" },
        "totalBytes": { "type": "integer", "minimum": 1 },
        "files": {
          "type": "array",
          "minItems": 1,
          "items": { "$ref": "#/$defs/artifactFile" }
        },
        "sharedComponentIDs": {
          "type": "array",
          "minItems": 1,
          "maxItems": 1,
          "uniqueItems": true,
          "items": { "type": "string", "minLength": 1 }
        }
      }
    },
    "artifactFile": {
      "type": "object",
      "additionalProperties": false,
      "required": ["relativePath", "sizeBytes", "sha256"],
      "properties": {
        "relativePath": { "type": "string", "minLength": 1 },
        "sizeBytes": { "type": "integer", "minimum": 1 },
        "sha256": { "type": "string", "pattern": "^[0-9a-f]{64}$" }
      }
    },
    "componentFile": {
      "type": "object",
      "additionalProperties": false,
      "required": ["relativePath", "byteCount", "sha256"],
      "properties": {
        "relativePath": { "type": "string", "minLength": 1 },
        "byteCount": { "type": "integer", "minimum": 1 },
        "sha256": { "type": "string", "pattern": "^[0-9a-f]{64}$" }
      }
    },
    "contentIdentity": {
      "type": "object",
      "additionalProperties": false,
      "required": ["schemaVersion", "digest", "files"],
      "properties": {
        "schemaVersion": { "const": 1 },
        "digest": { "type": "string", "pattern": "^[0-9a-f]{64}$" },
        "files": {
          "type": "array",
          "minItems": 1,
          "items": { "$ref": "#/$defs/componentFile" }
        }
      }
    },
    "compatibilityIdentity": {
      "type": "object",
      "additionalProperties": false,
      "required": [
        "schemaVersion",
        "digest",
        "contentDigest",
        "componentSchemaVersion",
        "loaderABI",
        "runtimeProfileSignature",
        "encoderCapability"
      ],
      "properties": {
        "schemaVersion": { "const": 1 },
        "digest": { "type": "string", "pattern": "^[0-9a-f]{64}$" },
        "contentDigest": { "type": "string", "pattern": "^[0-9a-f]{64}$" },
        "componentSchemaVersion": { "type": "integer", "minimum": 1 },
        "loaderABI": { "type": "string", "minLength": 1 },
        "runtimeProfileSignature": { "type": "string", "minLength": 1 },
        "encoderCapability": { "enum": ["decoderOnly", "encoderAndDecoder"] }
      }
    },
    "sharedComponent": {
      "type": "object",
      "additionalProperties": false,
      "required": [
        "id",
        "relativeRoot",
        "contentIdentity",
        "compatibilityIdentity",
        "sourceArtifactIdentities"
      ],
      "properties": {
        "id": { "type": "string", "minLength": 1 },
        "relativeRoot": { "type": "string", "minLength": 1 },
        "contentIdentity": { "$ref": "#/$defs/contentIdentity" },
        "compatibilityIdentity": { "$ref": "#/$defs/compatibilityIdentity" },
        "sourceArtifactIdentities": {
          "type": "array",
          "minItems": 1,
          "uniqueItems": true,
          "items": { "type": "string", "pattern": "^[a-z0-9_]+:[a-z0-9_]+$" }
        }
      }
    }
  }
}
