{
  "activationState": "complete",
  "allowedArtifactHosts": [
    "huggingface.co"
  ],
  "allowedRedirectHostSuffixes": [
    "huggingface.co",
    "hf.co"
  ],
  "artifacts": [
    {
      "artifactVersion": "2026.04.05.2",
      "baseURL": "https://huggingface.co/mlx-community/Qwen3-TTS-12Hz-1.7B-Base-8bit/resolve/e7dd0585652209fa0d7783659aad4e8a324de11c",
      "files": [
        {
          "relativePath": "README.md",
          "sha256": "7e03a5e92d1cd6208630c228e0b2fbf9b5de2035ebe189a7fc812a3453422c8c",
          "sizeBytes": 1026
        },
        {
          "relativePath": "config.json",
          "sha256": "b14fba6bfd391968876248b843b095696b0188187a3d774a3bddc32544d15627",
          "sizeBytes": 5522
        },
        {
          "relativePath": "generation_config.json",
          "sha256": "f1b90b4513f3b34c62851049e2492d7b4c5940daf1276f89c82b8ef04127f3aa",
          "sizeBytes": 245
        },
        {
          "relativePath": "merges.txt",
          "sha256": "599bab54075088774b1733fde865d5bd747cbcc7a547c5bc12610e874e26f5e3",
          "sizeBytes": 1671839
        },
        {
          "relativePath": "model.safetensors",
          "sha256": "b965c581ccf6aa852a4124feeb7a8a111542ee7b213139368b4cc7ba7fd4728b",
          "sizeBytes": 2417320525
        },
        {
          "relativePath": "model.safetensors.index.json",
          "sha256": "9592a7c0ac3261a6211978416ef1796d3841225ac0ff0f9d6bfb5d1a6b49e5e9",
          "sizeBytes": 78070
        },
        {
          "relativePath": "preprocessor_config.json",
          "sha256": "efdde1022ea9d76928bf7a9cd53139138f5ba2e466e837f08f6105ab1af1c119",
          "sizeBytes": 127
        },
        {
          "relativePath": "speech_tokenizer/config.json",
          "sha256": "ee65bb901c876664ab8707c487157aa1a6ee57c65969b28fb5ec9dc211e68167",
          "sizeBytes": 2336
        },
        {
          "relativePath": "speech_tokenizer/configuration.json",
          "sha256": "6bc26d64eb5024b4d1dab5a52371958b429256d6c9d59787f1f5294a54e0cebd",
          "sizeBytes": 76
        },
        {
          "relativePath": "speech_tokenizer/model.safetensors",
          "sha256": "836b7b357f5ea43e889936a3709af68dfe3751881acefe4ecf0dbd30ba571258",
          "sizeBytes": 682293092
        },
        {
          "relativePath": "speech_tokenizer/preprocessor_config.json",
          "sha256": "fcb3805e597e786d4067706e602f6688524640f8d3396790e2e09b5942fcbdfb",
          "sizeBytes": 234
        },
        {
          "relativePath": "tokenizer_config.json",
          "sha256": "dc3c31c3bdaedd5016382bb3cbe07323026775ad51f5a4fb564505992ae4a670",
          "sizeBytes": 7344
        },
        {
          "relativePath": "vocab.json",
          "sha256": "ca10d7e9fb3ed18575dd1e277a2579c16d108e32f27439684afa0e10b1440910",
          "sizeBytes": 2776833
        }
      ],
      "folder": "Qwen3-TTS-12Hz-1.7B-Base-8bit",
      "modelID": "pro_clone",
      "platforms": [
        "macOS"
      ],
      "repo": "mlx-community/Qwen3-TTS-12Hz-1.7B-Base-8bit",
      "revision": "e7dd0585652209fa0d7783659aad4e8a324de11c",
      "sharedComponentIDs": [
        "qwen3-speech-tokenizer-v1"
      ],
      "totalBytes": 3104157269,
      "variantID": "quality"
    },
    {
      "artifactVersion": "2026.04.05.2",
      "baseURL": "https://huggingface.co/mlx-community/Qwen3-TTS-12Hz-1.7B-Base-4bit/resolve/37e955a1deb861c088ae5f3a67043185f3d1a60c",
      "files": [
        {
          "relativePath": "README.md",
          "sha256": "21e7151db9b6316009265b788411a3e57d83651c40c653213b98f28a36a75bb8",
          "sizeBytes": 1026
        },
        {
          "relativePath": "config.json",
          "sha256": "36477d07e2ac89f79c1410a9782ed69860fbfcc871edea1728624389072e25fd",
          "sizeBytes": 5522
        },
        {
          "relativePath": "generation_config.json",
          "sha256": "f1b90b4513f3b34c62851049e2492d7b4c5940daf1276f89c82b8ef04127f3aa",
          "sizeBytes": 245
        },
        {
          "relativePath": "merges.txt",
          "sha256": "599bab54075088774b1733fde865d5bd747cbcc7a547c5bc12610e874e26f5e3",
          "sizeBytes": 1671839
        },
        {
          "relativePath": "model.safetensors",
          "sha256": "ac973aa38ec79d4b4b52bf858948f0d47dd909aa4bcd383f5b900e277410fdb5",
          "sizeBytes": 1649238423
        },
        {
          "relativePath": "model.safetensors.index.json",
          "sha256": "2b71cbd2c84cb59d0d71383cc55166ad7108180bfd7e47d2e3a6698f3721abfb",
          "sizeBytes": 78070
        },
        {
          "relativePath": "preprocessor_config.json",
          "sha256": "efdde1022ea9d76928bf7a9cd53139138f5ba2e466e837f08f6105ab1af1c119",
          "sizeBytes": 127
        },
        {
          "relativePath": "speech_tokenizer/config.json",
          "sha256": "ee65bb901c876664ab8707c487157aa1a6ee57c65969b28fb5ec9dc211e68167",
          "sizeBytes": 2336
        },
        {
          "relativePath": "speech_tokenizer/configuration.json",
          "sha256": "6bc26d64eb5024b4d1dab5a52371958b429256d6c9d59787f1f5294a54e0cebd",
          "sizeBytes": 76
        },
        {
          "relativePath": "speech_tokenizer/model.safetensors",
          "sha256": "836b7b357f5ea43e889936a3709af68dfe3751881acefe4ecf0dbd30ba571258",
          "sizeBytes": 682293092
        },
        {
          "relativePath": "speech_tokenizer/preprocessor_config.json",
          "sha256": "fcb3805e597e786d4067706e602f6688524640f8d3396790e2e09b5942fcbdfb",
          "sizeBytes": 234
        },
        {
          "relativePath": "tokenizer_config.json",
          "sha256": "dc3c31c3bdaedd5016382bb3cbe07323026775ad51f5a4fb564505992ae4a670",
          "sizeBytes": 7344
        },
        {
          "relativePath": "vocab.json",
          "sha256": "ca10d7e9fb3ed18575dd1e277a2579c16d108e32f27439684afa0e10b1440910",
          "sizeBytes": 2776833
        }
      ],
      "folder": "Qwen3-TTS-12Hz-1.7B-Base-4bit",
      "modelID": "pro_clone",
      "platforms": [
        "iOS",
        "macOS"
      ],
      "repo": "mlx-community/Qwen3-TTS-12Hz-1.7B-Base-4bit",
      "revision": "37e955a1deb861c088ae5f3a67043185f3d1a60c",
      "sharedComponentIDs": [
        "qwen3-speech-tokenizer-v1"
      ],
      "totalBytes": 2336075167,
      "variantID": "speed"
    },
    {
      "artifactVersion": "2026.04.05.2",
      "baseURL": "https://huggingface.co/mlx-community/Qwen3-TTS-12Hz-1.7B-CustomVoice-8bit/resolve/41d3337e8b7f2843a75841595fc14e4b9a7a4b96",
      "files": [
        {
          "relativePath": "README.md",
          "sha256": "50fe8f13fc95466beb50a96ae743e40573512754e80330373a043f4bd34d6212",
          "sizeBytes": 1118
        },
        {
          "relativePath": "config.json",
          "sha256": "43f29f9ab55cf387bd2ce1d07e9d95a5ca8974fa2fda4e2b45c13ae64aad3bfa",
          "sizeBytes": 6058
        },
        {
          "relativePath": "generation_config.json",
          "sha256": "f1b90b4513f3b34c62851049e2492d7b4c5940daf1276f89c82b8ef04127f3aa",
          "sizeBytes": 245
        },
        {
          "relativePath": "merges.txt",
          "sha256": "599bab54075088774b1733fde865d5bd747cbcc7a547c5bc12610e874e26f5e3",
          "sizeBytes": 1671839
        },
        {
          "relativePath": "model.safetensors",
          "sha256": "b696f4bf45f54497b6de758981e76f1410bd68af05a657477dee466b0202df1a",
          "sizeBytes": 2393308931
        },
        {
          "relativePath": "model.safetensors.index.json",
          "sha256": "2551ed02dc288b90cd6b7ec98652433f08ef2ae98fb3eda5248a4b9e5b47d08b",
          "sizeBytes": 71786
        },
        {
          "relativePath": "preprocessor_config.json",
          "sha256": "efdde1022ea9d76928bf7a9cd53139138f5ba2e466e837f08f6105ab1af1c119",
          "sizeBytes": 127
        },
        {
          "relativePath": "speech_tokenizer/config.json",
          "sha256": "ee65bb901c876664ab8707c487157aa1a6ee57c65969b28fb5ec9dc211e68167",
          "sizeBytes": 2336
        },
        {
          "relativePath": "speech_tokenizer/configuration.json",
          "sha256": "6bc26d64eb5024b4d1dab5a52371958b429256d6c9d59787f1f5294a54e0cebd",
          "sizeBytes": 76
        },
        {
          "relativePath": "speech_tokenizer/model.safetensors",
          "sha256": "836b7b357f5ea43e889936a3709af68dfe3751881acefe4ecf0dbd30ba571258",
          "sizeBytes": 682293092
        },
        {
          "relativePath": "speech_tokenizer/preprocessor_config.json",
          "sha256": "fcb3805e597e786d4067706e602f6688524640f8d3396790e2e09b5942fcbdfb",
          "sizeBytes": 234
        },
        {
          "relativePath": "tokenizer_config.json",
          "sha256": "dc3c31c3bdaedd5016382bb3cbe07323026775ad51f5a4fb564505992ae4a670",
          "sizeBytes": 7344
        },
        {
          "relativePath": "vocab.json",
          "sha256": "ca10d7e9fb3ed18575dd1e277a2579c16d108e32f27439684afa0e10b1440910",
          "sizeBytes": 2776833
        }
      ],
      "folder": "Qwen3-TTS-12Hz-1.7B-CustomVoice-8bit",
      "modelID": "pro_custom",
      "platforms": [
        "macOS"
      ],
      "repo": "mlx-community/Qwen3-TTS-12Hz-1.7B-CustomVoice-8bit",
      "revision": "41d3337e8b7f2843a75841595fc14e4b9a7a4b96",
      "sharedComponentIDs": [
        "qwen3-speech-tokenizer-v1"
      ],
      "totalBytes": 3080140019,
      "variantID": "quality"
    },
    {
      "artifactVersion": "2026.04.05.2",
      "baseURL": "https://huggingface.co/mlx-community/Qwen3-TTS-12Hz-1.7B-CustomVoice-4bit/resolve/f35faf19b0cc2160865af64ecf0f22f83d335135",
      "files": [
        {
          "relativePath": "README.md",
          "sha256": "481e4e53d6adf50558eb60eb15eae7eea67a3ca467dbe8e4eef9159f8d17d1f8",
          "sizeBytes": 1068
        },
        {
          "relativePath": "config.json",
          "sha256": "5a1dd8d7c9f4d04d5bdac309e9e748f16a96b0724d9c4de4974982dd84078715",
          "sizeBytes": 6058
        },